{
  "schemaVersion": 1,
  "id": "notification-demo",
  "route": "pages/notification_demo",
  "renderer": "surface-v1",
  "controller": "notification",
  "modules": [
    {
      "id": "homeHead",
      "type": "header",
      "visibleWhen": "homeVisible",
      "copy": { "title": "通知演示", "subtitle": "验证通知覆盖层与交互" },
      "tokens": { "flow": true, "height": 38, "titleWidth": 156, "trailingWidth": 0, "subtitleWidth": 156, "subtitleTrailingWidth": 0, "titleSize": 15, "subtitleSize": 7, "trailingSize": 0, "subtitleTrailingSize": 0, "titleLineHeight": 23, "subtitleLineHeight": 12, "titleColor": "#FFFFFF", "subtitleColor": "#8E8E93", "trailingColor": "#FFFFFF", "subtitleTrailingColor": "#8E8E93", "titleWeight": "bold", "trailingWeight": "normal" }
    },
    { "id": "sms", "type": "button", "visibleWhen": "homeVisible", "copy": { "title": "短信演示", "subtitle": "显示普通应用通知" }, "actions": { "tap": "notification-demo:sms" }, "tokens": { "flow": true, "marginTop": 12, "height": 52, "radius": 14, "paddingX": 14, "background": "#17191D", "titleSize": 11, "titleColor": "#FFFFFF", "titleWeight": "bold", "subtitleSize": 7, "subtitleTop": 3, "subtitleColor": "#8E8E93", "chevronWidth": 18, "chevronSize": 18, "chevronColor": "#636366", "chevronText": "›" } },
    { "id": "call", "type": "button", "visibleWhen": "homeVisible", "copy": { "title": "电话演示", "subtitle": "显示来电通知与挂断操作" }, "actions": { "tap": "notification-demo:call" }, "tokens": { "flow": true, "marginTop": 8, "height": 52, "radius": 14, "paddingX": 14, "background": "#17191D", "titleSize": 11, "titleColor": "#FFFFFF", "titleWeight": "bold", "subtitleSize": 7, "subtitleTop": 3, "subtitleColor": "#8E8E93", "chevronWidth": 18, "chevronSize": 18, "chevronColor": "#636366", "chevronText": "›" } },
    { "id": "app", "type": "button", "visibleWhen": "homeVisible", "copy": { "title": "应用演示", "subtitle": "显示第三方应用消息" }, "actions": { "tap": "notification-demo:app" }, "tokens": { "flow": true, "marginTop": 8, "height": 52, "radius": 14, "paddingX": 14, "background": "#17191D", "titleSize": 11, "titleColor": "#FFFFFF", "titleWeight": "bold", "subtitleSize": 7, "subtitleTop": 3, "subtitleColor": "#8E8E93", "chevronWidth": 18, "chevronSize": 18, "chevronColor": "#636366", "chevronText": "›" } },
    { "id": "back", "type": "button", "visibleWhen": "homeVisible", "copy": { "title": "返回", "subtitle": "" }, "actions": { "tap": "$back" }, "tokens": { "flow": true, "marginTop": 10, "height": 40, "radius": 14, "paddingX": 14, "background": "#2C2C2E", "titleSize": 10, "titleColor": "#8E8E93", "titleWeight": "bold", "subtitleSize": 0, "subtitleTop": 0, "subtitleColor": "#8E8E93", "chevronWidth": 0, "chevronSize": 0, "chevronColor": "#000000", "chevronText": "" } },

    { "id": "appHead", "type": "header", "visibleWhen": "appVisible", "copy": { "title": "应用通知", "subtitle": "10 秒后自动关闭" }, "bind": { "trailing": "appName" }, "tokens": { "flow": true, "height": 40, "titleWidth": 82, "trailingWidth": 74, "subtitleWidth": 156, "subtitleTrailingWidth": 0, "titleSize": 14, "subtitleSize": 7, "trailingSize": 10, "subtitleTrailingSize": 0, "titleLineHeight": 23, "subtitleLineHeight": 12, "titleColor": "#FFFFFF", "subtitleColor": "#8E8E93", "trailingColor": "#64D2FF", "subtitleTrailingColor": "#8E8E93", "titleWeight": "bold", "trailingWeight": "bold" } },
    { "id": "appContent", "type": "text", "visibleWhen": "appVisible", "copy": { "template": "{value}" }, "bind": { "value": "content" }, "tokens": { "flow": true, "marginTop": 32, "height": 92, "fontSize": 15, "lineHeight": 23, "foreground": "#D1D1D6", "textAlign": "center" } },
    { "id": "appDismiss", "type": "button", "visibleWhen": "appVisible", "copy": { "title": "忽略", "subtitle": "关闭这条通知" }, "actions": { "tap": "notification-dismiss" }, "tokens": { "flow": true, "marginTop": 28, "height": 44, "radius": 16, "paddingX": 14, "background": "#1C1C1E", "titleSize": 11, "titleColor": "#FFFFFF", "titleWeight": "bold", "subtitleSize": 7, "subtitleTop": 2, "subtitleColor": "#8E8E93", "chevronWidth": 0, "chevronSize": 0, "chevronColor": "#000000", "chevronText": "" } },

    { "id": "callHead", "type": "header", "visibleWhen": "callVisible", "copy": { "title": "来电", "subtitle": "模拟系统来电通知" }, "tokens": { "flow": true, "height": 40, "titleWidth": 156, "trailingWidth": 0, "subtitleWidth": 156, "subtitleTrailingWidth": 0, "titleSize": 14, "subtitleSize": 7, "trailingSize": 0, "subtitleTrailingSize": 0, "titleLineHeight": 23, "subtitleLineHeight": 12, "titleColor": "#FF453A", "subtitleColor": "#8E8E93", "trailingColor": "#FFFFFF", "subtitleTrailingColor": "#8E8E93", "titleWeight": "bold", "trailingWeight": "normal" } },
    { "id": "contact", "type": "text", "visibleWhen": "callVisible", "copy": { "template": "{value}" }, "bind": { "value": "contact" }, "tokens": { "flow": true, "marginTop": 34, "height": 52, "fontSize": 23, "lineHeight": 52, "foreground": "#FFFFFF", "textAlign": "center" } },
    { "id": "phone", "type": "text", "visibleWhen": "callVisible", "copy": { "template": "{value}" }, "bind": { "value": "phone" }, "tokens": { "flow": true, "marginTop": 2, "height": 32, "fontSize": 13, "lineHeight": 32, "foreground": "#8E8E93", "textAlign": "center" } },
    { "id": "callDismiss", "type": "button", "visibleWhen": "callVisible", "copy": { "title": "忽略", "subtitle": "保持电话状态不变" }, "actions": { "tap": "notification-dismiss" }, "tokens": { "flow": true, "marginTop": 30, "height": 44, "radius": 16, "paddingX": 14, "background": "#1C1C1E", "titleSize": 11, "titleColor": "#FFFFFF", "titleWeight": "bold", "subtitleSize": 7, "subtitleTop": 2, "subtitleColor": "#8E8E93", "chevronWidth": 0, "chevronSize": 0, "chevronColor": "#000000", "chevronText": "" } },
    { "id": "hangup", "type": "button", "visibleWhen": "hangupVisible", "copy": { "title": "挂断", "subtitle": "结束模拟来电" }, "actions": { "tap": "notification-hangup" }, "tokens": { "flow": true, "marginTop": 8, "height": 44, "radius": 16, "paddingX": 14, "background": "#C83245", "titleSize": 11, "titleColor": "#FFFFFF", "titleWeight": "bold", "subtitleSize": 7, "subtitleTop": 2, "subtitleColor": "#F2C5CB", "chevronWidth": 0, "chevronSize": 0, "chevronColor": "#000000", "chevronText": "" } }
  ],
  "tokens": { "background": "#000000", "stream": { "top": 0, "width": 164, "heightMode": "scene-bottom" }, "streamPaddingBottom": 18 },
  "variants": {
    "base": {},
    "circle": { "tokens": { "stream": { "top": 18, "width": 140, "heightMode": "scene-bottom" }, "streamPaddingBottom": 20 }, "modules": { "homeHead": { "height": 32, "titleSize": 12, "subtitleSize": 6 }, "sms": { "height": 44, "titleSize": 9, "subtitleSize": 6, "radius": 14 }, "call": { "height": 44, "titleSize": 9, "subtitleSize": 6, "radius": 14 }, "app": { "height": 44, "titleSize": 9, "subtitleSize": 6, "radius": 14 }, "back": { "height": 34, "titleSize": 8, "radius": 14 }, "appHead": { "height": 34, "titleSize": 11, "trailingSize": 8, "subtitleSize": 6 }, "appContent": { "height": 70, "fontSize": 11, "lineHeight": 18 }, "appDismiss": { "height": 38, "titleSize": 9, "subtitleSize": 6 }, "callHead": { "height": 34, "titleSize": 11, "subtitleSize": 6 }, "contact": { "height": 42, "fontSize": 18, "lineHeight": 42 }, "phone": { "height": 26, "fontSize": 10, "lineHeight": 26 }, "callDismiss": { "height": 38, "titleSize": 9, "subtitleSize": 6 }, "hangup": { "height": 38, "titleSize": 9, "subtitleSize": 6 } } },
    "pill": { "tokens": { "stream": { "top": 46, "width": 168, "heightMode": "scene-bottom" }, "streamPaddingBottom": 52 }, "modules": { "homeHead": { "height": 48, "titleSize": 20, "subtitleSize": 9, "titleLineHeight": 29, "subtitleLineHeight": 15 }, "sms": { "height": 62, "titleSize": 14, "subtitleSize": 8, "radius": 16 }, "call": { "height": 62, "titleSize": 14, "subtitleSize": 8, "radius": 16 }, "app": { "height": 62, "titleSize": 14, "subtitleSize": 8, "radius": 16 }, "back": { "height": 48, "titleSize": 12, "radius": 16 }, "appHead": { "height": 48, "titleSize": 18, "trailingSize": 13, "subtitleSize": 8 }, "appContent": { "height": 118, "fontSize": 17, "lineHeight": 26 }, "appDismiss": { "height": 52, "titleSize": 13, "subtitleSize": 8 }, "callHead": { "height": 48, "titleSize": 18, "subtitleSize": 8 }, "contact": { "height": 66, "fontSize": 28, "lineHeight": 66 }, "phone": { "height": 38, "fontSize": 16, "lineHeight": 38 }, "callDismiss": { "height": 52, "titleSize": 13, "subtitleSize": 8 }, "hangup": { "height": 52, "titleSize": 13, "subtitleSize": 8 } } },
    "rect": {}
  }
}
