{
  "schemaVersion": 1,
  "id": "applist",
  "route": "pages/applist",
  "renderer": "surface-v1",
  "controller": null,
  "modules": [],
  "tokens": { "background": "#000000" },
  "experience": {
    "base": {
      "collection": {
        "id": "apps",
        "items": [
          { "id": "workout", "label": "运动", "subtitle": "开始训练", "icon": "/common/icons/workout.jpg", "accent": "#3A7DFF", "action": "/pages/workout_select" },
          { "id": "history", "label": "趋势", "subtitle": "活动与健康历史", "icon": "/common/icons/history.jpg", "accent": "#30D158", "action": "/pages/history" },
          { "id": "heart", "label": "心率", "subtitle": "实时心率与趋势", "icon": "/common/icons/heart.jpg", "accent": "#FF375F", "action": "/pages/heartrate" },
          { "id": "clock", "label": "表盘", "subtitle": "返回主表盘", "icon": "/common/icons/clock.jpg", "accent": "#FFD60A", "action": "/pages/clock" },
          { "id": "steps", "label": "健康", "subtitle": "步数与活动目标", "icon": "/common/icons/health.jpg", "accent": "#64D2FF", "action": "/pages/steps" },
          { "id": "faces", "label": "表盘库", "subtitle": "选择表盘风格", "icon": "/common/icons/faces.jpg", "accent": "#BF5AF2", "action": "/pages/watchface" },
          { "id": "sync", "label": "同步", "subtitle": "设备数据同步", "icon": "/common/icons/sync.jpg", "accent": "#0A84FF", "action": "/pages/settings/bluetooth" },
          { "id": "brightness", "label": "亮度", "subtitle": "亮度与省电", "icon": "/common/icons/brightness.jpg", "accent": "#FFD60A", "action": "/pages/settings/brightness" },
          { "id": "settings", "label": "设置", "subtitle": "设备设置", "icon": "/common/icons/settings.jpg", "accent": "#8E8E93", "action": "/pages/settings/settings" },
          { "id": "vibration", "label": "振动", "subtitle": "反馈强度与模式", "icon": "/common/icons/vibration.jpg", "accent": "#FF9F0A", "action": "/pages/settings/vibration" },
          { "id": "notification", "label": "通知", "subtitle": "消息与来电演示", "icon": "/common/icons/notification.jpg", "accent": "#FF453A", "action": "/pages/notification_demo" },
          { "id": "today", "label": "今日日历", "subtitle": "摘要与月历", "icon": "/common/icons/calendar.jpg", "accent": "#30D158", "action": "/pages/today" }
        ],
        "actions": { "edgeBack": "$back" },
        "tokens": {}
      }
    },
    "circle": {
      "collection": {
        "mode": "honeycomb",
        "frame": { "bounds": "scene" },
        "tokens": {
          "background": "#000000",
          "spacing": 46, "rowHeight": 40, "focusX": 96, "focusY": 90,
          "iconBase": 34, "iconGrow": 16, "radiusRatio": 0.5, "emphasisFalloff": 60,
          "opacityBase": 0.48, "opacityEmphasis": 0.52, "avoidanceOpacity": 0.72,
          "elasticBase": 0.94, "elasticRange": 0.06, "elasticFalloff": 90,
          "dragDamping": 0.92, "maxFrameDelta": 24, "frameMs": 24,
          "overscrollLimit": 30, "overscrollDamping": 0.34,
          "inertiaDecay": 0.86, "minVelocity": 0.025, "magnetDistance": 22,
          "visibleMargin": 42, "labelCenterY": 168, "labelHalfHeight": 9, "labelHalfWidth": 43,
          "labelLeft": 53, "labelTop": 159, "labelWidth": 86, "labelHeight": 18,
          "labelSize": 9, "labelColor": "#FFFFFF", "movingLabelOpacity": 0.45,
          "snapDuration": 144, "dragThreshold": 6, "tapSuppressDuration": 220,
          "velocityPreviousWeight": 0.45, "velocitySampleWeight": 0.55,
          "edgeBackDistance": 58, "edgeBackStart": 26, "edgeBackVerticalLimit": 30
        }
      }
    },
    "pill": {
      "collection": {
        "mode": "paged-list",
        "frame": { "bounds": "scene" },
        "tokens": {
          "title": "应用", "titleWeight": "bold", "headerLeft": 12, "headerTop": 30, "headerWidth": 168, "headerHeight": 28,
          "titleSize": 18, "titleColor": "#FFFFFF", "pageSize": 8, "pageColor": "#8E8E93",
          "pageItemCount": 4, "contentLeft": 12, "contentTop": 68, "contentWidth": 168, "contentHeight": 300,
          "itemHeight": 62, "itemGap": 8, "itemRadius": 14, "itemPaddingX": 10, "itemBackground": "#111317",
          "iconSize": 40, "iconRadius": 20, "copyGap": 10, "nameSize": 14, "nameColor": "#FFFFFF", "nameWeight": "bold",
          "subtitleSize": 7, "subtitleColor": "#8E8E93", "arrowWidth": 18, "arrowSize": 20, "arrowText": "›",
          "pagerLeft": 12, "pagerTop": 414, "pagerWidth": 168, "pagerHeight": 24,
          "pagerPreviousText": "‹", "pagerNextText": "›", "pagerButtonWidth": 24, "pagerButtonSize": 18,
          "pagerTrackWidth": 112, "pagerTrackHeight": 4, "pagerMinProgressWidth": 1,
          "pagerTrackRadius": 2, "pagerTrackBackground": "#2C2C2E", "pagerAccent": "#FFFFFF", "pagerDisabledColor": "#3A3A3C"
        }
      }
    },
    "rect": {
      "collection": {
        "mode": "designed-grid",
        "frame": { "bounds": "scene" },
        "tokens": {
          "title": "应用", "titleWeight": "bold", "headerLeft": 14, "headerTop": 20, "headerWidth": 164, "headerHeight": 24,
          "titleSize": 14, "titleColor": "#FFFFFF", "pageSize": 8, "pageColor": "#8E8E93",
          "pageItemCount": 6, "contentLeft": 14, "contentTop": 54, "contentWidth": 164, "contentHeight": 174,
          "columns": 2, "gridItemWidth": 79, "gridGap": 6, "gridRowGap": 6,
          "itemHeight": 54, "itemRadius": 14, "itemBackground": "#111317", "itemBorderWidth": 1,
          "iconSize": 30, "iconRadius": 15, "nameSize": 9, "nameColor": "#FFFFFF", "nameWeight": "bold",
          "accentWidth": 22, "accentHeight": 2, "accentRadius": 1, "accentBottom": 5,
          "pagerLeft": 14, "pagerTop": 236, "pagerWidth": 164, "pagerHeight": 20,
          "pagerPreviousText": "‹", "pagerNextText": "›", "pagerButtonWidth": 22, "pagerButtonSize": 16,
          "pagerTrackWidth": 112, "pagerTrackHeight": 4, "pagerMinProgressWidth": 1,
          "pagerTrackRadius": 2, "pagerTrackBackground": "#2C2C2E", "pagerAccent": "#FFFFFF", "pagerDisabledColor": "#3A3A3C"
        }
      }
    }
  },
  "variants": { "base": {}, "circle": {}, "pill": {}, "rect": {} }
}
