{
  "schemaVersion": 1,
  "id": "watchface",
  "route": "pages/watchface",
  "renderer": "surface-v1",
  "controller": "watchface",
  "modules": [],
  "tokens": { "background": "#000000" },
  "experience": {
    "base": {
      "collection": {
        "id": "faces",
        "bind": { "selectedId": "selectedId" },
        "items": [
          { "id": "sport", "label": "活力数字", "description": "时间、心率、步数集中展示", "tag": "运动日常", "background": "#050505", "accent": "#0A84FF", "action": "watchface-select:sport" },
          { "id": "simple", "label": "极简霓虹", "description": "大时间和目标完成度", "tag": "简洁耐看", "background": "#040810", "accent": "#00E5FF", "action": "watchface-select:simple" },
          { "id": "dashboard", "label": "运动仪表", "description": "进度和关键健康指标", "tag": "数据控", "background": "#071007", "accent": "#32D74B", "action": "watchface-select:dashboard" },
          { "id": "mechanical", "label": "曜金机械", "description": "经典金色机械风格", "tag": "经典机械", "background": "#060708", "accent": "#D6B878", "action": "watchface-select:mechanical" },
          { "id": "alpine", "label": "星野远山", "description": "深色夜景与轻量数据层", "tag": "沉浸夜景", "background": "#020713", "accent": "#FF9F4A", "action": "watchface-select:alpine" }
        ],
        "actions": { "back": "$back", "edgeBack": "$back" },
        "tokens": { "idleBorderColor": "#2C2C2E" }
      }
    },
    "circle": {
      "controllerConfig": { "faceIds": ["sport", "simple", "dashboard", "mechanical"] },
      "collection": {
        "mode": "preview-swiper",
        "itemIds": ["sport", "simple", "dashboard", "mechanical"],
        "frame": { "bounds": "safe" },
        "tokens": {
          "title": "表盘库", "titleColor": "#FFFFFF", "titleWeight": "bold", "titleSize": 10,
          "backText": "返回", "backColor": "#8E8E93", "backSize": 8,
          "headerLeft": 34, "headerTop": 10, "headerWidth": 124, "headerHeight": 18,
          "previewLeft": 28, "previewTop": 32, "previewWidth": 136, "previewHeight": 112,
          "previewSize": 112, "previewRadius": 56, "previewBorderWidth": 1,
          "previewNameSize": 8, "previewNameColor": "#FFFFFF", "previewNameWeight": "bold", "previewNameMarginTop": 6,
          "tagSize": 7, "tagColor": "#8E8E93", "tagMarginTop": 3,
          "selectedLineLeft": 39, "selectedLineBottom": 7, "selectedLineWidth": 34, "selectedLineHeight": 3, "selectedLineRadius": 2,
          "footerLeft": 36, "footerTop": 148, "footerWidth": 120, "footerHeight": 16,
          "footerSize": 7, "footerColor": "#8E8E93", "footerSuffix": " · 点按应用",
          "indicator": true
        }
      }
    },
    "pill": {
      "controllerConfig": { "faceIds": ["sport", "simple", "dashboard", "alpine"] },
      "collection": {
        "mode": "cards-pager",
        "itemIds": ["sport", "simple", "dashboard", "alpine"],
        "frame": { "bounds": "safe" },
        "tokens": {
          "title": "表盘库", "titleColor": "#FFFFFF", "titleWeight": "bold", "titleSize": 18,
          "backText": "返回", "backColor": "#8E8E93", "backSize": 10,
          "headerLeft": 12, "headerTop": 0, "headerWidth": 168, "headerHeight": 30,
          "pageItemCount": 2, "contentLeft": 12, "contentTop": 42, "contentWidth": 168, "contentHeight": 276,
          "cardHeight": 126, "cardGap": 12, "cardBorderWidth": 1, "cardRadius": 14, "cardPadding": 10, "cardBackground": "#111317",
          "previewWidth": 64, "previewHeight": 106, "previewBorderWidth": 1, "previewRadius": 12,
          "copyMarginLeft": 10, "nameSize": 14, "nameColor": "#FFFFFF", "nameWeight": "bold",
          "selectedBadgeText": "已选", "badgeHeight": 18, "badgeRadius": 9, "badgeSize": 7, "badgePaddingX": 7, "badgeTextColor": "#FFFFFF",
          "descriptionSize": 8, "descriptionColor": "#8E8E93", "descriptionLineHeight": 13, "descriptionMarginTop": 7,
          "tagSize": 7, "tagMarginTop": 8,
          "pagerLeft": 12, "pagerTop": 323, "pagerWidth": 168, "pagerHeight": 24,
          "pagerPreviousText": "‹", "pagerNextText": "›", "pagerButtonWidth": 32, "pagerButtonSize": 22,
          "pagerButtonColor": "#0A84FF", "pagerTextSize": 8, "pagerTextColor": "#8E8E93"
        }
      }
    },
    "rect": {
      "controllerConfig": { "faceIds": ["sport", "simple", "dashboard"] },
      "collection": {
        "mode": "preview-grid",
        "itemIds": ["sport", "simple", "dashboard"],
        "frame": { "bounds": "safe" },
        "tokens": {
          "title": "表盘库", "titleColor": "#FFFFFF", "titleWeight": "bold", "titleSize": 14,
          "backText": "返回", "backColor": "#8E8E93", "backSize": 8,
          "headerLeft": 14, "headerTop": 0, "headerWidth": 164, "headerHeight": 24,
          "contentLeft": 14, "contentTop": 30, "contentWidth": 164, "contentHeight": 160,
          "columns": 2, "gridItemWidth": 78, "gridGap": 8, "gridRowGap": 8,
          "cardHeight": 76, "cardBorderWidth": 1, "cardRadius": 14, "cardPadding": 7, "cardBackground": "#111317",
          "previewHeight": 42, "previewRadius": 9,
          "accentWidth": 28, "accentHeight": 3, "accentRadius": 2, "accentMarginTop": 4,
          "nameSize": 8, "nameColor": "#FFFFFF", "nameWeight": "bold", "nameMarginTop": 5,
          "selectedText": "已选", "selectedSize": 7, "selectedMarginTop": 2,
          "currentLeft": 86, "currentTop": 84, "currentWidth": 78, "currentHeight": 76,
          "currentLabel": "CURRENT", "currentLabelSize": 7, "currentLabelColor": "#636366", "currentLetterSpacing": 1,
          "currentNameSize": 12, "currentNameWeight": "bold", "currentNameMarginTop": 5,
          "currentLineWidth": 36, "currentLineHeight": 3, "currentLineRadius": 2, "currentLineMarginTop": 6,
          "currentHint": "点击任意预览应用", "currentHintSize": 7, "currentHintColor": "#8E8E93", "currentHintMarginTop": 6
        }
      }
    }
  },
  "variants": { "base": {}, "circle": {}, "pill": {}, "rect": {} }
}
